{
  "format": "loom.diagram",
  "schemaVersion": "0.1.0",
  "id": "flovvas-massing-golden-case",
  "metadata": {
    "title": "Flovvas — From Conversation to Compounding Workspace",
    "description": "Golden Case for a two-page isometric product-evolution diagram.",
    "author": "Qizhi Dong",
    "createdAt": "2026-08-21T00:00:00+08:00",
    "updatedAt": "2026-08-21T00:00:00+08:00"
  },
  "semantic": {
    "diagramFamily": "logical-product-evolution",
    "nodes": [
      {
        "id": "stage-line",
        "type": "product-stage",
        "label": "LINE",
        "description": "Linear conversation as an ephemeral stream.",
        "componentRef": "flovvas-line",
        "visualRole": "main-stage",
        "phase": "conversation",
        "properties": { "sequence": 1, "cardCount": 6 }
      },
      {
        "id": "stage-branch",
        "type": "product-stage",
        "label": "BRANCH",
        "description": "Parallel exploration splits from one line.",
        "componentRef": "flovvas-branch",
        "visualRole": "main-stage",
        "phase": "exploration",
        "properties": { "sequence": 2, "branchCount": 3 }
      },
      {
        "id": "stage-card",
        "type": "product-stage",
        "label": "CARD",
        "description": "A thought becomes an operable unit.",
        "componentRef": "flovvas-card",
        "visualRole": "main-stage",
        "phase": "exploration",
        "properties": { "sequence": 3, "detached": true }
      },
      {
        "id": "stage-field",
        "type": "product-stage",
        "label": "FIELD",
        "description": "Relationships between thought units become visible.",
        "componentRef": "flovvas-field",
        "visualRole": "main-stage",
        "phase": "structure",
        "properties": { "sequence": 4, "columns": 4, "rows": 3 }
      },
      {
        "id": "stage-archive",
        "type": "product-stage",
        "label": "ARCHIVE",
        "description": "Selected thought units persist as knowledge.",
        "componentRef": "flovvas-archive",
        "visualRole": "main-stage",
        "phase": "knowledge",
        "properties": { "sequence": 5, "levels": 4 }
      },
      {
        "id": "stage-context",
        "type": "product-stage",
        "label": "CONTEXT",
        "description": "Stored knowledge becomes reusable working context.",
        "componentRef": "flovvas-context",
        "visualRole": "main-stage",
        "phase": "knowledge",
        "properties": { "sequence": 6, "layers": 3 }
      },
      {
        "id": "stage-workbench",
        "type": "product-stage",
        "label": "WORKBENCH",
        "description": "Context recombines into a compounding workspace.",
        "componentRef": "flovvas-workbench",
        "visualRole": "main-stage",
        "phase": "workspace",
        "properties": { "sequence": 7, "modules": 5 }
      },
      {
        "id": "alt-chat-only",
        "type": "alternative-path",
        "label": "Chat-only",
        "componentRef": "generic-card-slab",
        "visualRole": "alternative",
        "phase": "conversation",
        "properties": { "outcome": "evaporates" }
      },
      {
        "id": "alt-board-only",
        "type": "alternative-path",
        "label": "Board-only",
        "componentRef": "generic-card-slab",
        "visualRole": "alternative",
        "phase": "structure",
        "properties": { "outcome": "relationships without memory" }
      },
      {
        "id": "alt-storage-only",
        "type": "alternative-path",
        "label": "Storage-only",
        "componentRef": "generic-card-slab",
        "visualRole": "alternative",
        "phase": "knowledge",
        "properties": { "outcome": "memory without recombination" }
      },
      {
        "id": "input-human-intent",
        "type": "external-input",
        "label": "Human intent",
        "componentRef": "generic-input-plinth",
        "visualRole": "external-input",
        "properties": {}
      },
      {
        "id": "input-agent-output",
        "type": "external-input",
        "label": "Agent output",
        "componentRef": "generic-input-plinth",
        "visualRole": "external-input",
        "properties": {}
      },
      {
        "id": "input-files",
        "type": "external-input",
        "label": "Files",
        "componentRef": "generic-input-plinth",
        "visualRole": "external-input",
        "properties": {}
      },
      {
        "id": "input-links",
        "type": "external-input",
        "label": "Links",
        "componentRef": "generic-input-plinth",
        "visualRole": "external-input",
        "properties": {}
      },
      {
        "id": "input-prior-context",
        "type": "external-input",
        "label": "Prior context",
        "componentRef": "generic-input-plinth",
        "visualRole": "external-input",
        "properties": {}
      }
    ],
    "edges": [
      { "id": "edge-split", "source": "stage-line", "target": "stage-branch", "type": "transformation", "label": "SPLIT", "visualRole": "main-flow", "properties": {} },
      { "id": "edge-extract", "source": "stage-branch", "target": "stage-card", "type": "transformation", "label": "EXTRACT", "visualRole": "main-flow", "properties": {} },
      { "id": "edge-connect", "source": "stage-card", "target": "stage-field", "type": "transformation", "label": "CONNECT", "visualRole": "main-flow", "properties": {} },
      { "id": "edge-store", "source": "stage-field", "target": "stage-archive", "type": "transformation", "label": "STORE", "visualRole": "main-flow", "properties": {} },
      { "id": "edge-layer", "source": "stage-archive", "target": "stage-context", "type": "transformation", "label": "LAYER", "visualRole": "main-flow", "properties": {} },
      { "id": "edge-recombine", "source": "stage-context", "target": "stage-workbench", "type": "transformation", "label": "RECOMBINE", "visualRole": "main-flow", "properties": {} },
      { "id": "edge-alt-chat", "source": "stage-line", "target": "alt-chat-only", "type": "alternative", "visualRole": "alternative", "properties": {} },
      { "id": "edge-alt-board", "source": "stage-field", "target": "alt-board-only", "type": "alternative", "visualRole": "alternative", "properties": {} },
      { "id": "edge-alt-storage", "source": "stage-archive", "target": "alt-storage-only", "type": "alternative", "visualRole": "alternative", "properties": {} },
      { "id": "edge-input-intent", "source": "input-human-intent", "target": "stage-line", "type": "input", "visualRole": "external-input", "properties": {} },
      { "id": "edge-input-agent", "source": "input-agent-output", "target": "stage-card", "type": "input", "visualRole": "external-input", "properties": {} },
      { "id": "edge-input-files", "source": "input-files", "target": "stage-field", "type": "input", "visualRole": "external-input", "properties": {} },
      { "id": "edge-input-links", "source": "input-links", "target": "stage-archive", "type": "input", "visualRole": "external-input", "properties": {} },
      { "id": "edge-input-context", "source": "input-prior-context", "target": "stage-context", "type": "input", "visualRole": "external-input", "properties": {} },
      { "id": "edge-compound", "source": "stage-workbench", "target": "stage-context", "type": "feedback", "label": "COMPOUND", "visualRole": "compounding-loop", "properties": {} }
    ],
    "groups": [
      { "id": "phase-conversation", "type": "phase-zone", "label": "Conversation", "children": ["stage-line", "input-human-intent", "alt-chat-only"], "visualRole": "phase-zone", "properties": {} },
      { "id": "phase-exploration", "type": "phase-zone", "label": "Exploration", "children": ["stage-branch", "stage-card", "input-agent-output"], "visualRole": "phase-zone", "properties": {} },
      { "id": "phase-structure", "type": "phase-zone", "label": "Structure", "children": ["stage-field", "input-files", "alt-board-only"], "visualRole": "phase-zone", "properties": {} },
      { "id": "phase-knowledge-workspace", "type": "phase-zone", "label": "Knowledge → Workspace", "children": ["stage-archive", "stage-context", "stage-workbench", "input-links", "input-prior-context", "alt-storage-only"], "visualRole": "phase-zone", "properties": {} }
    ]
  },
  "composition": {
    "unit": "mm",
    "canvas": { "width": 594, "height": 210, "backgroundToken": "canvas.paper" },
    "pages": [
      { "id": "page-left", "label": "Left A4", "bounds": { "x": 0, "y": 0, "width": 297, "height": 210 } },
      { "id": "page-right", "label": "Right A4", "bounds": { "x": 297, "y": 0, "width": 297, "height": 210 } }
    ],
    "safeAreas": [
      { "id": "safe-outer", "kind": "margin", "bounds": { "x": 16, "y": 16, "width": 562, "height": 178 }, "policy": "advisory" },
      { "id": "safe-gutter", "kind": "gutter", "bounds": { "x": 291, "y": 0, "width": 12, "height": 210 }, "policy": "avoid-critical-content" }
    ],
    "readingDirection": "lower-left-to-upper-right",
    "defaultView": { "projection": "orthographic", "preset": "isometric", "azimuthDeg": 45, "elevationDeg": 35.264, "zoom": 1 }
  },
  "layout": {
    "engine": { "id": "golden-case-authored", "version": "0.1.0", "seed": "flovvas-v1" },
    "generated": {
      "nodes": {
        "stage-line": { "x": 70, "y": 165, "width": 52, "height": 26, "elevation": 4, "rotationYDeg": 0, "scale": 1, "zIndex": 10, "parameters": { "cardCount": 6 } },
        "stage-branch": { "x": 145, "y": 140, "width": 62, "height": 34, "elevation": 8, "rotationYDeg": 0, "scale": 1, "zIndex": 20, "parameters": { "branchCount": 3 } },
        "stage-card": { "x": 220, "y": 118, "width": 44, "height": 34, "elevation": 12, "rotationYDeg": 0, "scale": 1, "zIndex": 30, "parameters": { "detached": true } },
        "stage-field": { "x": 280, "y": 98, "width": 78, "height": 48, "elevation": 8, "rotationYDeg": 0, "scale": 1, "zIndex": 40, "parameters": { "columns": 4, "rows": 3 } },